{
  "format": "onto2d-nix-derivation-identity-case",
  "formatVersion": "1",
  "caseVersion": "nix-derivation-identity-v1",
  "generatedBy": "cases/nix-derivation-identity/extract.mjs",
  "source": {
    "format": "onto2d-nix-source-basis",
    "formatVersion": "1",
    "runtime": {
      "archiveSha256": "914c81dd92b26a5d73dfb9e9e3629bfea108668efefd80d3d42553e4a76b4424",
      "releaseUrl": "https://releases.nixos.org/nix/nix-2.31.0/nix-2.31.0-aarch64-darwin.tar.xz"
    },
    "sourceFiles": [
      {
        "bytes": 2125,
        "file": "fixtures/fixture.nix",
        "sha256": "7c0a609262682e5af3191fa571fde28fa1fc18f63392fdd46a9e8138320e73fd",
        "identity": "sha256:7c0a609262682e5af3191fa571fde28fa1fc18f63392fdd46a9e8138320e73fd"
      },
      {
        "bytes": 61,
        "file": "fixtures/output.txt",
        "sha256": "4a958ba7aa27996b7bee723e819f7871a02733985f2c4088c0484c061340ee45",
        "identity": "sha256:4a958ba7aa27996b7bee723e819f7871a02733985f2c4088c0484c061340ee45"
      }
    ],
    "captureFiles": [
      {
        "file": "capture/metadata.json",
        "bytes": 3835,
        "identity": "sha256:3e85d09ef659046d1127d93f89b6b8a632976232f4069d001fdf21e2a0d48bc5"
      },
      {
        "file": "capture/evaluation.json",
        "bytes": 1722,
        "identity": "sha256:90c7452a56dccba9b3541b5b1d097204b30fc9716da6c54194c4a87765b07f03"
      },
      {
        "file": "capture/derivations.json",
        "bytes": 9764,
        "identity": "sha256:4e9cee156444f18245250b5fb65eb63d4db0d34f7c405602b1044470f4c5f354"
      },
      {
        "file": "capture/native-output.json",
        "bytes": 503,
        "identity": "sha256:dc7cdc64a5e4aeb17c89c9a3dfee7885a09c55129f3780e0bc538a5f63201627"
      }
    ],
    "rawDerivations": [
      {
        "fixtureId": "sharedLeaf",
        "drvPath": "/nix/store/5b1gk8bc8bsf8ai3phb065ibc8s4q2m1-onto2d-shared-leaf.drv",
        "file": "capture/drv/5b1gk8bc8bsf8ai3phb065ibc8s4q2m1-onto2d-shared-leaf.drv",
        "bytes": 353,
        "identity": "sha256:0bff5fa7c42fb96b1104a2fd70946b4a8300f66ec0b30eeee7850567b3ca84ce"
      },
      {
        "fixtureId": "sharedInput",
        "drvPath": "/nix/store/yd8kip6kvasbc9s681v7ba0r5j7d48x0-onto2d-shared-input.drv",
        "file": "capture/drv/yd8kip6kvasbc9s681v7ba0r5j7d48x0-onto2d-shared-input.drv",
        "bytes": 498,
        "identity": "sha256:544292caff0a06770ebae73b2bdc8b63a41abf032e674910c007b8fe8ea5be83"
      },
      {
        "fixtureId": "leftInput",
        "drvPath": "/nix/store/k3gya6xkz57dcnm71784b6fcvncqg3c1-onto2d-left-input.drv",
        "file": "capture/drv/k3gya6xkz57dcnm71784b6fcvncqg3c1-onto2d-left-input.drv",
        "bytes": 346,
        "identity": "sha256:1cfcbda7542f78cc0266ee0253dd47468b7916ffb49cfc3000e092676f565b72"
      },
      {
        "fixtureId": "rightInput",
        "drvPath": "/nix/store/iv5xi9z1yy12smsa36m86vz5lfym3dh3-onto2d-right-input.drv",
        "file": "capture/drv/iv5xi9z1yy12smsa36m86vz5lfym3dh3-onto2d-right-input.drv",
        "bytes": 351,
        "identity": "sha256:ef2c55ef54f8276e490b90bb308c7ce183cba032b0d928fa7b37ed7e01845f4d"
      },
      {
        "fixtureId": "flagshipLeft",
        "drvPath": "/nix/store/xpwvg6b02hq13sjbr0jf4qp2z98qj2l0-onto2d-identical-output.drv",
        "file": "capture/drv/xpwvg6b02hq13sjbr0jf4qp2z98qj2l0-onto2d-identical-output.drv",
        "bytes": 999,
        "identity": "sha256:e8ada27fe097ae472eb070d35372eb99aec18077c68ecad0f0d8d32b603b4464"
      },
      {
        "fixtureId": "flagshipRight",
        "drvPath": "/nix/store/aicszibp40v8xgs2jkigpp7rqw82zaz9-onto2d-identical-output.drv",
        "file": "capture/drv/aicszibp40v8xgs2jkigpp7rqw82zaz9-onto2d-identical-output.drv",
        "bytes": 1002,
        "identity": "sha256:6af75df470f5a74eb3c6339e2ec91df55e0264e9540fc0d91d6c1c08e61e43c0"
      },
      {
        "fixtureId": "environmentBase",
        "drvPath": "/nix/store/ldq0bwnzwn9j81rf4splvclcas04sj5b-onto2d-identical-output.drv",
        "file": "capture/drv/ldq0bwnzwn9j81rf4splvclcas04sj5b-onto2d-identical-output.drv",
        "bytes": 825,
        "identity": "sha256:a0eb8d6f8115ed9ed8c28e2b68b84606c1f9ccd52bd6658457e98910198667c8"
      },
      {
        "fixtureId": "environmentMutated",
        "drvPath": "/nix/store/7spg5qxr8smifgjadvq1xlsjrqmnx0wy-onto2d-identical-output.drv",
        "file": "capture/drv/7spg5qxr8smifgjadvq1xlsjrqmnx0wy-onto2d-identical-output.drv",
        "bytes": 827,
        "identity": "sha256:69362b3de745415b8efcff2eacea04b0c07aa12afd68a1b1db700b6d8f24db59"
      },
      {
        "fixtureId": "inputAddressed",
        "drvPath": "/nix/store/zdc0zxixc2wg5l0c9bw4wqv5ja34fkap-onto2d-identical-output.drv",
        "file": "capture/drv/zdc0zxixc2wg5l0c9bw4wqv5ja34fkap-onto2d-identical-output.drv",
        "bytes": 688,
        "identity": "sha256:c3c759dfd1b7080f80910fb02f6b51d0431e0d8524a9fde93c0909240521ffe0"
      }
    ],
    "identity": "sha256:cf5dd45e533f4342a4eebf34adcbcb7a465432fd40b28fdc613180d4bc9cf5bb"
  },
  "captureBoundary": {
    "derivationBuildersExecuted": false,
    "derivationsInstantiatedByNix": true,
    "fixedOutputAddedByNix": true,
    "inputAddressedOutputRealized": false
  },
  "nix": {
    "version": "2.31.0",
    "platform": "aarch64-darwin",
    "storeDirectory": "/nix/store",
    "storeBackend": "local-root-remapped",
    "derivationJsonStatus": "experimental-in-nix-2.31.0"
  },
  "regimes": [
    {
      "id": "output-content",
      "label": "Output content",
      "compares": "Verified SHA-256 of materialized output bytes"
    },
    {
      "id": "derivation",
      "label": "Derivation",
      "compares": "Native Nix .drv store path"
    },
    {
      "id": "input-closure",
      "label": "Input closure",
      "compares": "Exact transitive inputDrvs closure and topology"
    },
    {
      "id": "builder-environment",
      "label": "Builder environment",
      "compares": "builder-env-v1 over system, builder, arguments, and declared environment"
    },
    {
      "id": "history-class",
      "label": "History equivalence",
      "compares": "Verified output content under output-content-v1"
    }
  ],
  "nativeOutput": {
    "ca": "fixed:sha256:0igf809hck28q2440b2zk0rjg83ig2gq2gkjxrxnp697makqp5aa",
    "contentBytes": 61,
    "contentSha256": "4a958ba7aa27996b7bee723e819f7871a02733985f2c4088c0484c061340ee45",
    "contentUtf8": "Onto2D Nix identity fixture\nsame bytes, distinct derivations\n",
    "materialization": "nix-store-add-file",
    "narHash": "sha256-pb36FMe08ojFDuxk9CTNvZgOXcsz36M8jvtf1M4563A=",
    "narSize": 176,
    "path": "/nix/store/a257mzf98qsbkp8p9wxm2l99z6gg6sdz-onto2d-identical-output",
    "references": []
  },
  "derivations": [
    {
      "fixtureId": "sharedLeaf",
      "drvPath": "/nix/store/5b1gk8bc8bsf8ai3phb065ibc8s4q2m1-onto2d-shared-leaf.drv",
      "drvName": "onto2d-shared-leaf",
      "rawIdentity": "sha256:0bff5fa7c42fb96b1104a2fd70946b4a8300f66ec0b30eeee7850567b3ca84ce",
      "outputPath": "/nix/store/h5zfwjdxg9afcacvrw4yad39lk60s7wg-onto2d-shared-leaf",
      "outputAddressing": "input-addressed",
      "outputContentIdentity": null,
      "outputEvidence": "unrealized",
      "directInputDrvs": [],
      "inputSrcs": [],
      "system": "aarch64-darwin",
      "builder": "/bin/sh",
      "args": [
        "-c",
        "printf '%s\\n' shared-leaf > \"$out\""
      ],
      "env": {
        "builder": "/bin/sh",
        "fixtureRole": "shared-leaf",
        "name": "onto2d-shared-leaf",
        "out": "/nix/store/h5zfwjdxg9afcacvrw4yad39lk60s7wg-onto2d-shared-leaf",
        "system": "aarch64-darwin"
      },
      "native": {
        "args": [
          "-c",
          "printf '%s\\n' shared-leaf > \"$out\""
        ],
        "builder": "/bin/sh",
        "env": {
          "builder": "/bin/sh",
          "fixtureRole": "shared-leaf",
          "name": "onto2d-shared-leaf",
          "out": "/nix/store/h5zfwjdxg9afcacvrw4yad39lk60s7wg-onto2d-shared-leaf",
          "system": "aarch64-darwin"
        },
        "inputDrvs": {},
        "inputSrcs": [],
        "name": "onto2d-shared-leaf",
        "outputs": {
          "out": {
            "path": "/nix/store/h5zfwjdxg9afcacvrw4yad39lk60s7wg-onto2d-shared-leaf"
          }
        },
        "system": "aarch64-darwin"
      },
      "inputClosure": {
        "format": "onto2d-nix-input-closure",
        "formatVersion": "1",
        "members": [],
        "edges": [],
        "identity": "sha256:5b00a0a0d289ebeaf01a4ecd14155cd279c2a1b778b07204c610a48f0e9dd0c5"
      },
      "builderEnvironment": {
        "format": "onto2d-nix-builder-environment",
        "formatVersion": "1",
        "profile": "builder-env-v1",
        "system": "aarch64-darwin",
        "builder": "/bin/sh",
        "args": [
          "-c",
          "printf '%s\\n' shared-leaf > \"$out\""
        ],
        "env": {
          "builder": "/bin/sh",
          "fixtureRole": "shared-leaf",
          "name": "onto2d-shared-leaf",
          "out": "/nix/store/h5zfwjdxg9afcacvrw4yad39lk60s7wg-onto2d-shared-leaf",
          "system": "aarch64-darwin"
        },
        "identity": "sha256:d8f9d6d1ae70a7cd857c3b142ef60305ffedd74981588871732270d34a89111e"
      },
      "depth": 0
    },
    {
      "fixtureId": "sharedInput",
      "drvPath": "/nix/store/yd8kip6kvasbc9s681v7ba0r5j7d48x0-onto2d-shared-input.drv",
      "drvName": "onto2d-shared-input",
      "rawIdentity": "sha256:544292caff0a06770ebae73b2bdc8b63a41abf032e674910c007b8fe8ea5be83",
      "outputPath": "/nix/store/5r1mm4y5a86iqx5jr65w96qnkdpz1yj0-onto2d-shared-input",
      "outputAddressing": "input-addressed",
      "outputContentIdentity": null,
      "outputEvidence": "unrealized",
      "directInputDrvs": [
        {
          "fixtureId": "sharedLeaf",
          "drvPath": "/nix/store/5b1gk8bc8bsf8ai3phb065ibc8s4q2m1-onto2d-shared-leaf.drv",
          "outputs": [
            "out"
          ]
        }